,title,description,originallink,link,pubDate
704,경기 이재민 확진자 4명으로 증가…안양 3명은 같은 임시시설,집중호우로 임시주거시설에 수용됐다가 코로나19에 확진된 경기지역 이재민이 4명으로 늘어났다. 18일... 잇따라 코로나19 확진 판정을 받았다. 앞서 지난 12일과 15일 안양7동행정복지센터 임시주거시설에 있던 이재민... ,https://www.yna.co.kr/view/AKR20220818035700061?input=1195m,https://n.news.naver.com/mnews/article/001/0013382084?sid=102,"Thu, 18 Aug 2022 09:25:00 +0900"
705,장성군청 민원실 방역은 KT AI 방역로봇이 맡는다…직원·민원인 &apos;호평&apos;,각 지자체가 코로나19 재유행으로 방역 강화 조치에 고민이 많은 가운데 장성군의 발 빠른 최첨단 방역로봇... 지자체가 늘고 있다”며 “KT의 최첨단 AI 기술이 코로나19 확산 예방에도 큰 도움이 될 것”이라고 강조했다.,http://www.etnews.com/20220818000016,https://n.news.naver.com/mnews/article/030/0003037612?sid=102,"Thu, 18 Aug 2022 09:24:00 +0900"
706,"고양특례시, 어린이통학버스 운행기록장치 장착비용 지원 신청 마감 임박","관내 학원·교습소·사립유치원 통학버스 대상… 9월 30일까지 고양시청사 전경 고양특례시(시장 이동환)는 코로나19 장기화로 운영에 어려움을 겪고 있는 관내 학원, 교습소, 사립유치원의 위기 극복 지원을 위해 지난... ",http://www.metroseoul.co.kr/article/20220818500030,http://www.metroseoul.co.kr/article/20220818500030,"Thu, 18 Aug 2022 09:24:00 +0900"
707,글로벌 자동차 예비부품 가격 뛴다…타이어·엔진오일 등 10~15% 인상,"코로나 제로 정책으로 공장이 봉쇄되어 타이어, 엔진오일 등의 예비 부품 생산이 제대로 되지 않아 일부 품목의 경우 가격이 약 25% 상승했다. 이로 인해, 글로벌 주요 자동차 공장들이 가동을 하지 못하고 있다. 코로나... ",http://www.g-enews.com/ko-kr/news/article/news_all/20220818091455746e8b8a793f7_1/article.html,http://www.g-enews.com/ko-kr/news/article/news_all/20220818091455746e8b8a793f7_1/article.html,"Thu, 18 Aug 2022 09:24:00 +0900"
708,"[인터뷰] 홍석준 ""국민 &apos;삶의 질&apos; 해결할 큰 울림 주는 규제 개혁할 것""","홍 의원은 ""코로나19 시대를 거치면서 국민 생활과 직접적인 관련이 생긴 원격 의료 부분이나, 환경평가제도의 합리적인 개혁으로 국민 생활을 많이 구속하고 있는 부분을 개선하는 등 큰 울림을 줄수 있는 개혁을 하고 싶다... ",https://www.dailian.co.kr/news/view/1143667/?sc=Naver,https://n.news.naver.com/mnews/article/119/0002631190?sid=100,"Thu, 18 Aug 2022 09:24:00 +0900"
709,"한국인은 음주 민족?···롯데멤버스 설문, “성인 절반, 술자리 좋아요”","원래부터 다른 주종 대비 판매량이 압도적으로 많은 맥주의 경우 판매량이 6% 증가, 코로나19 사태 이전과 비슷한 수준을 유지 중이었다. 전통주 판매량은 오프라인 유통점 거래 데이터 기준 2019년 상반기 대비 올... ",https://www.etoday.co.kr/news/view/2164577,https://www.etoday.co.kr/news/view/2164577,"Thu, 18 Aug 2022 09:24:00 +0900"
710,충북 신규 확진 6304명…127일 만에 6000명대,충북의 신종 코로나바이러스 감염증(코로나19)이 연일 확산세를 더하며 지난 17일에는 127일 만에 6000명대 확진자가 나왔다. 사망자도 2명 발생했다. 18일 충북도에 따르면 전날 도내 11개 시·군에서... ,https://www.news1.kr/articles/4776277,https://n.news.naver.com/mnews/article/421/0006283678?sid=102,"Thu, 18 Aug 2022 09:24:00 +0900"
711,"코로나19에 무너진 &apos;문화·콘텐츠&apos;, 하반기 채용시장 달군다",인크루트는 835개 기업 대상으로 올해 하반기 &apos;업종별 신입 채용계획&apos;을 조사한 결과 문화·콘텐츠 분야에서 채용 계획이 있다고 밝힌 기업이 68.6%로 지난해 같은 조사보다 41.3%포인트 증가했다고 18일 밝혔다. 이번... ,http://news.mt.co.kr/mtview.php?no=2022081809065242849,https://n.news.naver.com/mnews/article/008/0004784331?sid=101,"Thu, 18 Aug 2022 09:24:00 +0900"
712,"[속보] 18일 0시 기준 대구 9,933, 경북 1만125, 전국 17만8,574명 코로나19 ...","18일 0시 기준 코로나19 추가 확진(중앙방역대책본부 집계)▶대구= 추가 확진 9,933명, 누적 91만9,,026명☞달서구 2,190명, 북구 1,905명, 동구 1,529명, 수성구 1,503명, 달성군 1,171명, 서구 562명,  남구... ",https://www.yeongnam.com/web/view.php?key=20220818000916068,https://www.yeongnam.com/web/view.php?key=20220818000916068,"Thu, 18 Aug 2022 09:24:00 +0900"
713,"한수원, 체코 글로벌 봉사활동 재개","올해로 4년차를 맞이하는 체코 글로벌 봉사활동은 2017년도부터 2019년까지 매년 시행됐으나, 코로나19... 봉사단장인 한수원 전대욱 기획본부장은 ""코로나19로 인해 중단됐던 한국과 체코의 교류가 이번 글로벌 봉사활동을... ",http://www.ikld.kr/news/articleView.html?idxno=259323,http://www.ikld.kr/news/articleView.html?idxno=259323,"Thu, 18 Aug 2022 09:24:00 +0900"
714,"박형배 전주시의원, 코로나 격리기간에 ‘뱃놀이’ 즐기다 덜미",(출처: 뉴시스) 더불어민주당 박형배 전주시의원이 신종 코로나바이러스 감염증(코로나19) 확진 상태에서 바다낚시를 즐기다 경찰 조사를 받게 됐다. 18일 전주시의회 등에 따르면 박 의원은 지난달 27일 낮 12시께... ,http://www.newscj.com/article/20220818580113,http://www.newscj.com/article/20220818580113,"Thu, 18 Aug 2022 09:24:00 +0900"
715,"경기도, &apos;K뷰티 시장 개척 나선다&apos;…대만·인니서 &apos;K-뷰티 엑스포&apos; 개최",다년간 노하우 바탕으로 수출상담회 등 코로나19 상황에 맞춰 전방위 판로개척 지원 경기도가 &apos;K-뷰티... 또한 코로나19 변수를 감안해 현지 입국이 어려운 참가 기업을 위해서는 현지에서 부스를 대신 운영할 통역원... ,https://www.pressian.com/pages/articles/2022081809215449414?utm_source=naver&utm_medium=search,https://n.news.naver.com/mnews/article/002/0002255553?sid=101,"Thu, 18 Aug 2022 09:24:00 +0900"
716,"교보생명, 집중호우 피해 2억 전달","교보생명은 지난 2020년 코로나19 극복 지원 성금, 집중호우 피해 복구 성금을 전국재해구호협회에 전달한 바 있다. 3월에는 강원·경북 산불 피해 복구 성금을 기부하는 등 재해·재난 복구 지원을 위한 다양한... ",http://www.shinailbo.co.kr/news/articleView.html?idxno=1588223,http://www.shinailbo.co.kr/news/articleView.html?idxno=1588223,"Thu, 18 Aug 2022 09:24:00 +0900"
717,"NH농협은행, 코로나19 확산 방지 위한 &apos;방역핀패드&apos; 전 영업점으로 확대","NH농협은행은 코로나19 확산 방지와 고객의 안전한 금융 거래를 위해 9월 중순까지 &apos;방역핀패드&apos; 1700대를... 조상진 IT부문 부행장은 ""최근 코로나19 재확산에 따라 확대를 서두르게 됐다""며 ""고객 가치를 최우선으로... ",http://www.fnnews.com/news/202208180919194767,https://n.news.naver.com/mnews/article/014/0004884869?sid=101,"Thu, 18 Aug 2022 09:24:00 +0900"
718,"코빗, EDM 페스티벌 &apos;울트라 코리아 2022&apos; NFT 판매","오세진 코빗 대표는 ""코로나19 여파로 3년 만에 열리는 축제인 만큼 NFT로 평생 소장해 축제를 더 의미 있게 기억할 수 있다""라며 ""다양한 행사와 연계해 코빗의 NFT를 많은 분들에게 소개하고 싶다""라고... ",https://www.ddaily.co.kr/news/article.html?no=244762,https://n.news.naver.com/mnews/article/138/0002130923?sid=105,"Thu, 18 Aug 2022 09:24:00 +0900"
719,"SK그룹, 베트남 1위 약국체인 파마시티 지배력 강화…대표이사 선임","파마시티는 코로나19 기간동안 2025년까지 전국에 매장을 5000개까지 확대한다는 웅대한 계획과 함께, 전통적인 약국서비스와 기본적 의료서비스를 결합한 포괄적인 의료생태계를 구축할 것이라고 발표한... ",http://www.insidevina.com/news/articleView.html?idxno=21135,http://www.insidevina.com/news/articleView.html?idxno=21135,"Thu, 18 Aug 2022 09:24:00 +0900"
720,"식품진흥원, 식품산업 현장의 에이스 키운다... 취준생-기업 모두 &apos;만족&apos;",◇역량 갖춘 인재 배출…기업 구인 고민 해결 국가식품클러스터 산업단지 내 입주기업들은 코로나19가 확산되던 2019년부터 현재까지 &apos;구인난&apos;이 계속되고 있다고 우려한다. 구직 시장이 얼어붙었다고 하지만 중소기업의... ,https://www.asiatoday.co.kr/view.php?key=20220817010009640,https://www.asiatoday.co.kr/view.php?key=20220817010009640,"Thu, 18 Aug 2022 09:24:00 +0900"
721,"법무부 인천공항출입국·외국인청, 항공사 길들이기 논란",특히 코로나 팬데믹 사태 이후 입국자 PCR증명서 확인 탑승에 대한 제재가 출입국·외국인청의 사무가 되면서... 않고 코로나19로 입국거부 외국인이 줄었다는 이유로 기획재정부에서 예산을 깍아 15명만 기간제 공무직으로... ,http://www.metroseoul.co.kr/article/20220817500054,http://www.metroseoul.co.kr/article/20220817500054,"Thu, 18 Aug 2022 09:24:00 +0900"
722,"[B tv 전주뉴스] 전북교육청, 정상등교 원칙…대면수업 중단 &apos;최소화&apos;",코로나19가 재확산세를 보이고 있는 가운데 학교는 개학을 앞두고 있죠. 전북교육청이 2학기 학사운영과 방역... ========================================= [유철미 기자] 전북교육청은 그간 코로나19 대응 경험을 바탕으로 2학기에도... ,http://ch1.skbroadband.com/content/view?parent_no=25&content_no=75&p_no=144967,http://ch1.skbroadband.com/content/view?parent_no=25&content_no=75&p_no=144967,"Thu, 18 Aug 2022 09:24:00 +0900"
723,"코빗, &apos;울트라 코리아 2022&apos; NFT 판매...&apos;입장부터 굿즈까지&apos;","오세진 코빗 대표는 ""코로나19 여파로 3년 만에 열리는 축제인 만큼 NFT로 평생 소장해 축제를 더 의미 있게 기억할 수 있다""며 ""앞으로도 다양한 행사와 연계해 코빗의 NFT를 많은 분들에게 소개하고 싶다""고... ",https://www.businessplus.kr/news/articleView.html?idxno=36429,https://www.businessplus.kr/news/articleView.html?idxno=36429,"Thu, 18 Aug 2022 09:24:00 +0900"
724,"애플, 베트남서 애플워치·맥북도 생산하나",애플은 당초 지난해 1월 탈중국 및 공급망 다변화 전략의 일환으로 중국 생산라인 일부를 베트남으로 이전키로 했으나 코로나19 상황 악화로 연기했다가 최근에 이전을 완료했다는 것이다. 애플은 올들어 인도서... ,http://www.insidevina.com/news/articleView.html?idxno=21136,http://www.insidevina.com/news/articleView.html?idxno=21136,"Thu, 18 Aug 2022 09:24:00 +0900"
725,"KT, 초등생 라이브 교육 서비스 &apos;크루디&apos; 론칭","박정호 KT 커스터머DX사업단 상무는 ""코로나19로 온라인 기반의 교육은 이제 새로운 교육 패러다임으로 자리 잡았으며, 지금보다 발전된 온라인 학습의 새로운 표준이 필요한 시점이다""라며 ""KT가 보유한 AI 기반의... ",http://www.newsway.co.kr/news/view?tp=1&ud=2022081809185095264,http://www.newsway.co.kr/news/view?tp=1&ud=2022081809185095264,"Thu, 18 Aug 2022 09:24:00 +0900"
726,[특징주] 현대바이오 상승 출발 &apos;먹는 코로나 치료제 임상 빨라&apos;,현대바이오는 범용 항바이러스제 후보물질인 CP-COV03의 코로나19 임상2상에 참여한 누적 환자 수가 이... 현재 CP-COV03의 코로나19 임상2상은 베스티안과 김포 우리병원에 이어 지난 11일 환자모집을 시작한 고대... ,https://www.gukjenews.com/news/articleView.html?idxno=2531265,https://www.gukjenews.com/news/articleView.html?idxno=2531265,"Thu, 18 Aug 2022 09:24:00 +0900"
727,"베트남항공, 내달 한국 등 주요노선 대거 증편","(사진=vietnambiz) 국영 베트남항공이 코로나19 이후 관광수요가 급증하고 있는 한국, 태국 등 국제선 항공편을 내달부터 대거 증편한다. 베트남항공에 따르면 9월15일부터 인천-하노이/호치민 노선을 각각 주1회... ",http://www.insidevina.com/news/articleView.html?idxno=21134,http://www.insidevina.com/news/articleView.html?idxno=21134,"Thu, 18 Aug 2022 09:24:00 +0900"
728,&apos;혁명가 아미를 찾는다&apos; 이 공지로 시작된 놀라운 일,"맨 왼쪽부터 달지, 얌몬, 뚲 님 ⓒ 희망제작소 2020년 2월, 빠르게 확산되는 코로나19 때문에 4월로 예정됐던... 지난 3월에 코로나 여파로 무함성 콘서트를 해야 했는데, 마침 생일을 맞은 멤버가 있어서 저희가 이번 기회에... ",http://www.ohmynews.com/NWS_Web/View/at_pg.aspx?CNTN_CD=A0002858032&CMPT_CD=P0010&utm_source=naver&utm_medium=newsearch&utm_campaign=naver_news,https://n.news.naver.com/mnews/article/047/0002363287?sid=102,"Thu, 18 Aug 2022 09:23:00 +0900"
729,"연세의료원·코이카, 세네갈에 10억원 규모 의료기자재 전달",연세대학교 의료원과 한국국제협력단(KOICA·코이카)은 세네갈의 코로나19 대응 능력 제고와 모자보건... 연세의료원과 코이카는 세네갈의 코로나19 대응을 지원하고 있다. 양 기관은 ▲진단검사 지원을 통한 코로나19 환자... ,https://view.asiae.co.kr/article/2022081809234069737,https://n.news.naver.com/mnews/article/277/0005134274?sid=102,"Thu, 18 Aug 2022 09:23:00 +0900"
730,"10명 중 6명, 국내여행 계획 “해외여행도 21%”","코로나 엔데믹 후 첫 여름휴가 시즌을 맞아 여행에 대한 니즈가 커지는 가운데, 해외여행 분위기도... 극성수기로 불리는 7~8월뿐 아니라 9월 이후 늦은 휴가 수요도 높은 것으로 나타났는데, 코로나 재확산과 이른... ",http://www.fnnews.com/news/202208180920055091,https://n.news.naver.com/mnews/article/014/0004884867?sid=103,"Thu, 18 Aug 2022 09:23:00 +0900"
731,충남서 17일 8358명 확진…방역당국 ‘초비상’,뉴데일리 김정원 기자 = 충남에서 지난 17일 발생한 신종 코로나바이러스 감염증(코로나19) 확진자는 8358명으로 큰 폭으로 증가하며 방역당국이 비상이 걸렸다. 이날 확진자는 전날보다 816명이 증가하는 등... ,https://cc.newdaily.co.kr/site/data/html/2022/08/18/2022081800013.html,https://cc.newdaily.co.kr/site/data/html/2022/08/18/2022081800013.html,"Thu, 18 Aug 2022 09:22:00 +0900"
732,"CJ프레시웨이, 햄버거·샌드위치·샐러드 전년비 51% 성장","이는 코로나19 여파로 간편식과 배달 및 테이크아웃 음식 시장이 커지면서 햄버거·샌드위치·샐러드에 대한 수요가 증가함에 따라 발 빠르게 업종 특화 상품 라인업을 갖추고, 고객사 전용 상품을 개발하는 등 다양한 밀... ",http://www.businesskorea.co.kr/news/articleView.html?idxno=98652,http://www.businesskorea.co.kr/news/articleView.html?idxno=98652,"Thu, 18 Aug 2022 09:22:00 +0900"
733,"‘골린이’ 이은 어린이 ‘골프’… 온라인 시장 매출, 1조원 돌파",(제공: 아이템스카우트) [천지일보=황해연 기자] 신종 코로나바이러스 감염증(코로나19) 기간 온라인 마켓에서 빠르게 성장한 골프 시장이 사회적 거리두기 해제 이후 저변을 확대하며 급격히 매출이 늘고 있는... ,http://www.newscj.com/article/20220818580110,http://www.newscj.com/article/20220818580110,"Thu, 18 Aug 2022 09:22:00 +0900"
734,[속보]18일 코로나19 신규 확진자 17만8천여 명 ... 지난주 대비 4만천여 명 ...,18일(목) 코로나19 신규 확진자는 17만8천명대를 나타냈다. 각 지자체 등에 따르면 이날 0시 기준 신규 확진자는 17만8574명이며 전주 수요일(13만7241명) 대비 4만쳔여 명 많다. 이로써 누적 확진자는 총... ,https://idsn.co.kr/news/view/1065572144245649,https://idsn.co.kr/news/view/1065572144245649,"Thu, 18 Aug 2022 09:22:00 +0900"
735,"방탄소년단 초콜릿! 한국마즈X스니커즈, &apos;BTS 스페셜 에디션&apos; 출시",이번 컬래버는 스니커즈의 든든함과 코로나 팬데믹 등 예상치 못한 상황 속에서도 에너제틱한 퍼포먼스와 노래로 전 세계에 희망의 메시지를 전한 방탄소년단의 긍정적인 울림을 더해 &apos;허기진 몸뿐 아니라... ,http://www.slist.kr/news/articleView.html?idxno=377547,http://www.slist.kr/news/articleView.html?idxno=377547,"Thu, 18 Aug 2022 09:22:00 +0900"
736,"하이트진로, ‘2022 이슬라이브 페스티벌’ 공식 티켓 판매 시작",이슬라이브 페스티벌은 국내 유일의 소주 뮤직페스티벌로 코로나19로 인해 2019년 이후 3년만에 열린다. 올해는 9월 3일 경기도 가평군 자라섬에서 진행된다. 하이트진로 마케팅실 오성택 상무는 “이슬라이브... ,https://www.dnews.co.kr/uhtml/view.jsp?idxno=202208180911592850758,https://www.dnews.co.kr/uhtml/view.jsp?idxno=202208180911592850758,"Thu, 18 Aug 2022 09:22:00 +0900"
737,철저한 준비로 국제안전도시 연차대회 성공 개최,시는 코로나 19 상황으로 지난 2년간 행사를 미뤄온 만큼 이번 대회에서 국제안전도시 간 교류협력과 학술의 장이 되도록 남은 기간 행정력을 집중한다는 계획이다. 이런 가운데 최근 코로나 상황이 재유행하면서 시는... ,http://www.joongdo.co.kr/web/view.php?key=20220818010004917,http://www.joongdo.co.kr/web/view.php?key=20220818010004917,"Thu, 18 Aug 2022 09:22:00 +0900"
738,영동군서 &apos;KBS 전국 노래자랑&apos; 열려,"선사하고, 전국에 영동의 매력을 알리는 계기가 되길 기대하고 있다. 군 관계자는 ""코로나19로 움츠러들었던 활력을 다시 찾고, 군민 소통과 화합의 무대가 될 수 있도록 내실있게 행사를 준비하겠다.""라고 말했다.",https://www.gukjenews.com/news/articleView.html?idxno=2531252,https://www.gukjenews.com/news/articleView.html?idxno=2531252,"Thu, 18 Aug 2022 09:22:00 +0900"
739,"청주 지하상가, 역사 속으로 사라진다",대현프리몰은 성안길 상권 쇠퇴와 코로나19로 인한 경영악화가 겹쳐지면서 지금 두손 두발을 든 상태다. 대현지하상가의 점포들은 이달 말까지만 운영하고 모두 철수하기로 했다. 이미 점포들이 거의 다 빠진 상태다.... ,http://www.ccreview.co.kr/news/articleView.html?idxno=314209,http://www.ccreview.co.kr/news/articleView.html?idxno=314209,"Thu, 18 Aug 2022 09:22:00 +0900"
740,"[신상품라운지]깨끗한나라, 추석맞이 &apos;안심선물세트&apos; 출시","깨끗한나라 관계자는 ""코로나19(COVID-19) 재유행으로 감염병 불안 요소가 커짐에 따라 철저한 위생 관리가 요구되고 있다""면서 ""깨끗한나라 클린 안심선물세트로 고마운 마음을 전하고 동시에 가족, 친지 분들의 건강도... ",http://news.mt.co.kr/mtview.php?no=2022081809012334512,https://n.news.naver.com/mnews/article/008/0004784330?sid=101,"Thu, 18 Aug 2022 09:21:00 +0900"
741,"하반기 채용계획 급상승 업종, 문화·콘텐츠>자동차>제조>식음료>여행·항공","코로나 기저효과와 더불어 국내 디지털 콘텐츠 시장 급성장, 투자유치 활성화 등이 신입 채용계획에 긍정적인 영향을 미친 것으로 보인다. 다음은 ▲자동차·부품(66.7%)으로 작년 대비 35.9%p 올랐다. 해당 업종의... ",https://www.news2day.co.kr/article/20220818500036,https://www.news2day.co.kr/article/20220818500036,"Thu, 18 Aug 2022 09:20:00 +0900"
742,"롯데免, 인천 외식업체 40곳 선정 골목상권 지원 나섰다",롯데면세점은 코로나19 장기화로 외식경영에 어려움을 겪고 있는 소상공인을 돕기 위한 ‘치어럽스(CHEERUPS)... 프로젝트 2기 40곳 선정 기념촬영을 하고 있다. 코로나 어려움 겪는 소상공인 위한 치어럽스 프로젝트 2기 진행,https://www.ekn.kr/web/view.php?key=20220818010003148,https://www.ekn.kr/web/view.php?key=20220818010003148,"Thu, 18 Aug 2022 09:20:00 +0900"
743,"[‘코로나19’ 통합뉴스룸 LIVE] 신규 확진 17만 8,574명…위중증 470명",,https://news.kbs.co.kr/news/view.do?ncd=5535683&amp;ref=A,https://n.news.naver.com/mnews/article/056/0011322959?sid=102,"Thu, 18 Aug 2022 09:20:00 +0900"
744,"아산시, &apos;청년월세 한시 특별지원사업&apos; 추진",&apos;청년월세 한시 특별지원&apos;은 코로나19 장기화로 인해 경제적 어려움을 겪고 있는 저소득 청년층의 주거비 부담 경감을 위해 정부가 한시적으로 추진하는 사업이다. 지원 대상은 아산시에 전입신고를 완료한 만... ,http://www.chungnamilbo.co.kr/news/articleView.html?idxno=674830,http://www.chungnamilbo.co.kr/news/articleView.html?idxno=674830,"Thu, 18 Aug 2022 09:20:00 +0900"
745,"[특징주] 원숭이두창 관련주 강세, WHO ""92개국, 3만5천건 넘었다""",WHO는 코로나19 대유행 시기에 전 세계의 백신 공급이 불균형적이었던 전례를 되풀이하지 않아야 한다는 취지로 원숭이두창을 85%가량 막아주는 효과가 있는 것으로 알려진 천연두 예방 백신을 효과적으로 배분할... ,https://www.gokorea.kr/news/articleView.html?idxno=728704,https://www.gokorea.kr/news/articleView.html?idxno=728704,"Thu, 18 Aug 2022 09:20:00 +0900"
746,"[기고] 김대중 13주기, 복지 후퇴를 우려한다","서민 물가가 크게 오르고 있고 2년 반 동안 이어진 코로나19로 인한 민생경제 전반의 피해와 위축이 심각한... 이른바 &apos;3고(고유가, 고물가, 고금리) 시대&apos;에 코로나19의 재유행이 더해지는 고난의 시기에, 항상 진지한... ",http://www.chungnamilbo.co.kr/news/articleView.html?idxno=674823,http://www.chungnamilbo.co.kr/news/articleView.html?idxno=674823,"Thu, 18 Aug 2022 09:20:00 +0900"
747,"코빗, EDM 페스티벌 &apos;울트라 코리아 2022&apos; NFT 판매 시작","오세진 코빗 대표는 ""코로나19 여파로 3년 만에 열리는 축제인 만큼 NFT로 평생 소장해 축제를 의미있게 기억할 수 있다""며 ""앞으로도 다양한 행사와 연계해 코빗의 NFT를 많은 분들에게 소개하고 싶다""고... ",https://www.ziksir.com/news/articleView.html?idxno=29228,https://www.ziksir.com/news/articleView.html?idxno=29228,"Thu, 18 Aug 2022 09:20:00 +0900"
748,강원 신규 확진 5639명…이틀 연속 5000명대,강원지역에서 코로나19 신규 확진자 5639명이 발생했다. 이틀 연속 5000명대다. 18일 강원도에 따르면 지난 17일 발생한 도내 코로나19 신규 확진자 수는 5639명으로 집계됐다. 이는 전날(5176명)보다 463명... ,https://www.news1.kr/articles/4776268,https://n.news.naver.com/mnews/article/421/0006283661?sid=102,"Thu, 18 Aug 2022 09:19:00 +0900"
749,[뉴스라이더] 초저가 치킨 논란...프랜차이즈 치킨값 못 내리는 이유는?,코로나와 싸우면서 자영업자들이 만들어 놓은 시장에 들어와서 저가 치킨으로 시장을 교란하고 있기 때문에 저희들은 이들을 대기업의 횡포로 보고 있고 그리고 또한 이들과 싸워서 이기는 것이 건물주와 임차인의 싸움.... ,https://www.ytn.co.kr/_ln/0103_202208180919159682,https://n.news.naver.com/mnews/article/052/0001778142?sid=102,"Thu, 18 Aug 2022 09:19:00 +0900"
750,"어반베이스, 일본 상업용 부동산 기업 앳 오피스와 계약...일본 상업용 부동산...","일본 또한 코로나19 영향으로 비대면 부동산 거래에 대한 관심이 높아지면서, 주거용은 물론 상업용 분야에서도 온라인 중개 서비스 도입 사례가 점차 증가하고 있다. 앳 오피스는 어반베이스 3D 인테리어를 활용해... ",http://mirakle.mk.co.kr/view.php?year=2022&no=729607,https://n.news.naver.com/mnews/article/009/0005005785?sid=105,"Thu, 18 Aug 2022 09:19:00 +0900"
751,"하이트진로, ‘2022 이슬라이브 페스티벌’ 공식 티켓 판매 시작",인터뷰 영상은 참이슬 SNS를 통해 확인할 수 있다. 이슬라이브 페스티벌은 국내 유일의 소주 뮤직페스티벌로 코로나19로 인해 2019년 이후 3년만에 열린다. 올해는 9월 3일 경기도 가평군 자라섬에서 진행된다.,http://www.betanews.net:8080/article/1357105.html,http://www.betanews.net:8080/article/1357105.html,"Thu, 18 Aug 2022 09:18:00 +0900"
752,"뉴진스vs블랙핑크, 하반기 주주들을 웃게 할 걸그룹은 누구?",그래픽 임지혜 기자 지난해 코로나 19의 여파로 부진했던 엔터사들의 주가가 소속 아티스트들의 연이은... 급락하며 코로나 이전 주가 수준으로 회기 한 듯 보였으나 하이브 산하의 레이블 &apos;어도어&apos;에서 새롭게 선보인... ,http://www.pinpointnews.co.kr/news/articleView.html?idxno=136493,http://www.pinpointnews.co.kr/news/articleView.html?idxno=136493,"Thu, 18 Aug 2022 09:18:00 +0900"
