,title,description,originallink,link,pubDate
495,"경희사이버대, &apos;제4회 한국어교육 크리에이터 공모전&apos; 개최",공모전은 온라인 교육에 대한 높은 관심과 이해도가 요구되는 코로나19 시대에 온라인 한국어 교육의 비전을 제시하고 창의적인 한국어 콘텐츠 개발 역량을 펼칠 수 있는 기회를 제공하고자 기획됐다. 공모전은 글로벌... ,https://news.unn.net/news/articleView.html?idxno=532479,https://news.unn.net/news/articleView.html?idxno=532479,"Thu, 18 Aug 2022 09:42:00 +0900"
496,"애터미, 호우 피해복구 위해 2억 상당 물품 기탁","한편 애터미는 지난 3월 동해안 산불피해 복구를 위해 1억원 성금을 전달한 것을 비롯해 2020년 호우피해 1억원, 2020년 코로나 구호성금 1억원, 지난해 4억원 상당의 물품을 전달했다. 작년 애터미의 기부금은 매출액의 2.... ",http://www.newsway.co.kr/news/view?tp=1&ud=2022081809365814494,http://www.newsway.co.kr/news/view?tp=1&ud=2022081809365814494,"Thu, 18 Aug 2022 09:42:00 +0900"
497,"이브자리 슬립앤슬립, ‘쿠잠’ 출시…항균 기능성 제품 확대",슬립앤슬립은 코로나바이러스(코로나19)의 여파로 위생 관리가 더욱 중시됨에 따라 청결한 수면환경을 돕는 항균 기능성 라인업을 한층 강화한다는 방침이다. 신제품 쿠잠 시리즈는 이불·베개·토퍼·패드 등으로... ,http://www.edaily.co.kr/news/newspath.asp?newsid=01676086632428632,https://n.news.naver.com/mnews/article/018/0005294891?sid=101,"Thu, 18 Aug 2022 09:42:00 +0900"
498,"KB국민카드, 해외 저소득층 아동 위해 고객 참여형 봉사활동 실시","이번 캠페인은 코로나19 상황을 고려한 비대면 사회공헌 활동으로 KB금융그룹 캐릭터인 스타프렌즈가 도안된 티셔츠에 고객이 직접 채색해 완성하는 ‘사랑T’ 만들기와 가정 내 재사용이 가능한 의류, 학용품 등... ",https://www.cnbnews.com/news/article.html?no=560329,https://www.cnbnews.com/news/article.html?no=560329,"Thu, 18 Aug 2022 09:42:00 +0900"
499,"은평, &apos;2022 을지연습&apos; 실시…“빈틈없는 국가안보”","그간 코로나19 상황 대응에 정부 역량을 집중해 축소 시행됐으나, 올해는 국가위기관리 및 총력전 대응... 김미경 은평구청장은 “그동안 코로나19로 인해 축소됐던 을지연습을 다시 실시하게 되는 만큼 빈틈없이 준비해... ",http://www.shinailbo.co.kr/news/articleView.html?idxno=1588219,http://www.shinailbo.co.kr/news/articleView.html?idxno=1588219,"Thu, 18 Aug 2022 09:42:00 +0900"
500,"수소전시회 H2 MEET, 영국, 네덜란드, 캐나다, 호주 등 11개국 63개 기업. 기...","8월 31일 개막을 앞둔 수소산업 전문전시회 &apos;H2 MEET 2022&apos;가 코로나 19에도 불구, 해외 기업, 기관, 장. 차관급 정부관계자 등 VIP들의 참여가 늘어나고 있다. H2MEET 조직위원회에 따르면, 올해 H2 MEET에 참가하는... ",http://www.autodaily.co.kr/news/articleView.html?idxno=436090,http://www.autodaily.co.kr/news/articleView.html?idxno=436090,"Thu, 18 Aug 2022 09:42:00 +0900"
501,"은평, &apos;2022 을지연습&apos; 실시…“빈틈없는 국가안보”","그간 코로나19 상황 대응에 정부 역량을 집중해 축소 시행됐으나, 올해는 국가위기관리 및 총력전 대응... 김미경 은평구청장은 “그동안 코로나19로 인해 축소됐던 을지연습을 다시 실시하게 되는 만큼 빈틈없이 준비해... ",http://www.shinailbo.co.kr/news/articleView.html?idxno=1588219,http://www.shinailbo.co.kr/news/articleView.html?idxno=1588219,"Thu, 18 Aug 2022 09:42:00 +0900"
502,[속보] 18일 코로나 신규 확진자 17만 8574명 &apos;재유행 정점&apos;,"속보 (사진-국제뉴스DB) 중앙방역대책본부는 18일 0시 기준으로 신종 코로나바이러스 감염증(코로나19) 위중증 환자는 470명, 사망자는 61명이라고 밝혔다. 국내 발생 신규 확진자는 17만7941명... ",https://www.gukjenews.com/news/articleView.html?idxno=2531283,https://www.gukjenews.com/news/articleView.html?idxno=2531283,"Thu, 18 Aug 2022 09:42:00 +0900"
503,"NH농협카드, 간편 전자계약 서비스 ‘모두싸인’ 최대 57% 할인","농협카드 관계자는 ""코로나19 등 불안정한 상황에서 어려운 시기를 겪고 있는 개인사업자분들에게 실질적인 혜택을 제공하기 위해 이번 이벤트를 준비했다""며 ""앞으로도 고객에게 필요한 혜택과 적합한 서비스를... ",http://www.fntimes.com/html/view.php?ud=20220818093354751146fd2a8c7d_18,http://www.fntimes.com/html/view.php?ud=20220818093354751146fd2a8c7d_18,"Thu, 18 Aug 2022 09:42:00 +0900"
504,"“교외로, 타주로, 멕시코로” 탈LA 가속화",멕시코의 집값도 오름세가 시작된 것으로 나타났습니다. 티후아나의 부동산협회장에 따르면 코로나19 팬데믹 이후 중산층이 찾는 주택의 가격은 약 30% 인상된 것으로 확인됐습니다. 라디오코리아 뉴스 박세나입니다.,https://www.radiokorea.com/news/article.php?uid=395269,https://www.radiokorea.com/news/article.php?uid=395269,"Thu, 18 Aug 2022 09:42:00 +0900"
505,"“교외로, 타주로, 멕시코로” 탈LA 가속화",멕시코의 집값도 오름세가 시작된 것으로 나타났습니다. 티후아나의 부동산협회장에 따르면 코로나19 팬데믹 이후 중산층이 찾는 주택의 가격은 약 30% 인상된 것으로 확인됐습니다. 라디오코리아 뉴스 박세나입니다.,https://www.radiokorea.com/news/article.php?uid=395268,https://www.radiokorea.com/news/article.php?uid=395268,"Thu, 18 Aug 2022 09:42:00 +0900"
506,"인천광역시, &apos;DMZ 평화의길 강화군 테마 노선&apos; 개방","한편 윤현모 해양항공국장은 “이번 테마노선 개방을 통해 코로나로 지친 시민들에게는 활력을, 섬 지역에는 관광객 유치 등 새로운 동력이 되길 바란다”라고 말했다.",https://idsn.co.kr/news/view/1065573403213653,https://idsn.co.kr/news/view/1065573403213653,"Thu, 18 Aug 2022 09:42:00 +0900"
507,"시흥시, 소상공인시장진흥공단 시흥센터 개소","임병택 시흥시장은 “시흥센터 개소는 코로나19로 위기에 처한 관내 3만여 소상공인들에게 큰 힘이 될 것”이라며 “현장 밀착지원을 통해 소상공인과 전통시장의 경쟁력 제고 및 자생력 강화, 지역경제 활성화 등을... ",http://www.shinailbo.co.kr/news/articleView.html?idxno=1588216,http://www.shinailbo.co.kr/news/articleView.html?idxno=1588216,"Thu, 18 Aug 2022 09:42:00 +0900"
508,"경희사이버대, &apos;제4회 한국어교육 크리에이터 공모전&apos; 개최",공모전은 온라인 교육에 대한 높은 관심과 이해도가 요구되는 코로나19 시대에 온라인 한국어 교육의 비전을 제시하고 창의적인 한국어 콘텐츠 개발 역량을 펼칠 수 있는 기회를 제공하고자 기획됐다. 공모전은 글로벌... ,https://news.unn.net/news/articleView.html?idxno=532479,https://news.unn.net/news/articleView.html?idxno=532479,"Thu, 18 Aug 2022 09:42:00 +0900"
509,"코로나 19 신규 확진 17만 8,574명 재원중 위중증 환자 470명 사망자 61명"," 코로나 19 신규 확진 환자가 17만 8,574명 증가했다. 재원중 위중증 환자는 470명, 사망자는 61명으로... 코로나19 병상 보유량은 전체 7,305병상이다. 병상 가동률은 위중증병상 45.4%, 준-중증병상 60.5... ",http://www.whosaeng.com/138180,http://www.whosaeng.com/138180,"Thu, 18 Aug 2022 09:42:00 +0900"
510,"안동시, 전국단위 대회 연이어 개최",안동시 관계자는 “연이은 전국단위 대회 개최로 대내외 선수 및 관계자들이 안동을 방문해 코로나19로 침체된 지역경제 활성화에 기여할 것으로 기대한다”고 말했다.,https://www.cnbnews.com/news/article.html?no=560330,https://www.cnbnews.com/news/article.html?no=560330,"Thu, 18 Aug 2022 09:42:00 +0900"
511,"롯데카드, 현대카드 제치고 4위… KB국민·하나카드 실적 뒷걸음",카드사들의 지속적인 비용 효율화에 더해 신종 코로나바이러스 감염증(코로나19) 확산에 따른 사회적 거리두기가 올 4월 전면 해제된 영향으로 분석된다. 18일 카드업계에 따르면 올 상반기 8개 카드사의 순이익은 총... ,http://moneys.mt.co.kr/news/mwView.php?no=2022081809325432021,https://n.news.naver.com/mnews/article/417/0000843827?sid=101,"Thu, 18 Aug 2022 09:42:00 +0900"
512,"경북 봉화군, 60세 이상 재택치료 독거노인 모니터링 실시","특히 봉화군보건소는 그동안 관내 의료기관의 협조를 통해 코로나19 검사부터 처방, 치료까지 원스톱으로... 것이며 코로나19 재유행에 맞서 24시간 행정상담센터 운영 등 재택치료자 관리에 만전을 기하겠다”고 말했다.... ",https://www.viva100.com/main/view.php?key=20220818010004411,https://www.viva100.com/main/view.php?key=20220818010004411,"Thu, 18 Aug 2022 09:42:00 +0900"
513,&apos;2022 충남 라이브커머스 온라인 종합상담회&apos; 성료,이번 행사는 최근 중국 등 주요 교역국의 코로나19 재확산으로 인한 수출지연과 우크라이나 사태의 장기화로 인해 수출중소기업의 어려움이 가중됨에 따라 글로벌 공급망 위기에 대한 선제적 대응의 일환으로... ,http://www.ccnnews.co.kr/news/articleView.html?idxno=266227,http://www.ccnnews.co.kr/news/articleView.html?idxno=266227,"Thu, 18 Aug 2022 09:42:00 +0900"
514,"농협은행, 방역핀패드 1700대 확대 운영",[사진=NH농협은행] NH농협은행은 신종 코로나바이러스 감염증(이하 코로나19) 확산 방지와 고객의 안전한 금융 거래를 위해 다음 달 중순까지 방역핀패드 1700대를 전 영업점에 도입·운영한다. 18일 NH농협은행에 따르면... ,http://www.psnews.co.kr/news/articleView.html?idxno=2012861,http://www.psnews.co.kr/news/articleView.html?idxno=2012861,"Thu, 18 Aug 2022 09:42:00 +0900"
515,[속보]거리두기 전면해제 후 코로나19 재유행…18일 신규 확진자 17만8574명,거리두기 전면해제 후 코로나19 재유행으로 18일 신규 확진자 수가 이틀째 10만명대 후반을 기록했다. 중앙방역대책본부는 이날 0시 기준으로 코로나19 확진자가 17만8천574명 늘어 누적 2천186만1천296명이... ,http://www.kwnews.co.kr/page/view/2022081809400509904,https://n.news.naver.com/mnews/article/087/0000918009?sid=102,"Thu, 18 Aug 2022 09:41:00 +0900"
516,"주한미국상의, &apos;워싱턴 도어녹&apos; 열고 IPEF 등 협력 방안 모색","암참의 &apos;워싱턴 도어녹&apos;은 미국의 고위 관리·정책 입안자들과 만나 협력 방안을 모색하는 프로그램으로, 신종 코로나바이러스 감염증(코로나19) 대유행으로 인해 2019년 이후 3년 만에 재개됐다.",https://www.yna.co.kr/view/AKR20220818040500003?input=1195m,https://n.news.naver.com/mnews/article/001/0013382159?sid=101,"Thu, 18 Aug 2022 09:41:00 +0900"
517,코로나19 위중증 470명‥신규 확진 17만 8천574명,"조금 전 중앙방역대책본부는 오늘 0시 기준 코로나19 신규 확진자가 17만 8574명 발생했으며, 위중증환자는 470명, 사망자는 61명이라고 밝혔습니다.",https://imnews.imbc.com/replay/2022/nw930/article/6399213_35736.html,https://n.news.naver.com/mnews/article/214/0001216441?sid=004,"Thu, 18 Aug 2022 09:41:00 +0900"
518,"CJ프레시웨이 ""버거·샐러드 수요증가에 식자재 매출 51.6%↑""","CJ프레시웨이 관계자는 매출 증가 배경에 대해 ""코로나19 여파로 간편식과 배달·테이크아웃 음식 시장이 커지면서 햄버거·샌드위치·샐러드에 대한 수요가 증가함에 따라 업종 특화 상품 라인업을 갖추고 관련 사업에... ",https://www.yna.co.kr/view/AKR20220818041900003?input=1195m,https://n.news.naver.com/mnews/article/001/0013382166?sid=101,"Thu, 18 Aug 2022 09:41:00 +0900"
519,"고양시, 어린이통학버스 운행기록장치 지원 9월 30일 마감",이 사업은 코로나19 장기화로 운영에 어려움을 겪고 있는 관내 학원·교습소·사립유치원의 위기 극복 지원을 위해 마련됐다. 지난해 1월 시행된 ‘교통안전법’ 제55조(운행기록장치의 장착 및 운행기록의 활용 등)에... ,https://www.news1.kr/articles/4776314,https://n.news.naver.com/mnews/article/421/0006283755?sid=102,"Thu, 18 Aug 2022 09:40:00 +0900"
520,7월 韓영화는 울고 극장은 웃었다..관객수는 줄었는데 매출은 회복 왜?,2022년 7월 극장 전체 매출액이 코로나19 팬데믹 이전 수준을 회복했다. 이는 관객수는 코로나19 이전부터 감소했지만 영화 관람료가 3년 연속 올랐기 때문이다. 18일 영화진흥위원회가 발표한 한국영화산업 결산... ,http://star.mt.co.kr/stview.php?no=2022081808320457269,https://n.news.naver.com/mnews/article/108/0003079704?sid=106,"Thu, 18 Aug 2022 09:40:00 +0900"
521,신규 확진 17만 8천여 명‥전주 대비 1.3배 증가,"오늘 0시 기준 코로나19 신규 확진자는 17만 8천574명으로 집계됐습니다. 어제보다 2천229명 적은... 1명 증가한 470명으로, 병상 가동률은 45.4%를 기록했습니다. 어제 하루 코로나19로 숨진 사람은 61명이었습니다.",https://imnews.imbc.com/news/2022/society/article/6399210_35673.html,https://n.news.naver.com/mnews/article/214/0001216437?sid=102,"Thu, 18 Aug 2022 09:40:00 +0900"
522,"고양시, 어린이통학버스 운행기록장치 장착비용 지원","고양특례시(시장 이동환)는 코로나19 장기화로 운영에 어려움을 겪고 있는 관내 학원, 교습소, 사립유치원의 위기 극복 지원을 위해 지난 4월부터 지원 중인 어린이통학버스 운행기록장치 장착비용 지원 신청이 오는... ",http://www.discoverynews.kr/news/articleView.html?idxno=859417,http://www.discoverynews.kr/news/articleView.html?idxno=859417,"Thu, 18 Aug 2022 09:40:00 +0900"
523,"제약협동조합 조용준 이사장, 사용량 약가 연동제 개선 건의","이 자리에서 조용준 이사장은 코로나19 극복을 위해 정부와 제약업계가 함께 노력한 것에 대해 긍정적인 평가를 하며, 코로나19 영향으로 처방이 급증한 제품의 사용량 약가연동제에 대한 예외 적용을 적극 건의했다.... ",http://www.yakup.com/news/index.html?mode=view&cat=12&nid=272476,http://www.yakup.com/news/index.html?mode=view&cat=12&nid=272476,"Thu, 18 Aug 2022 09:40:00 +0900"
524,"예천군, 여름철 폭염대비 위기가구 집중 발굴","마음안심서비스 앱으로 취약계층 안부 확인 경북 예천군은 오는 31일까지 무더위와 코로나19 재유행으로... 뿐만 아니라 군은 코로나19 재유행으로 비대면 상담도 병행하고 전화, 카카오톡 채널 예천군청 챗봇 등으로... ",https://www.asiatoday.co.kr/view.php?key=20220818010010574,https://www.asiatoday.co.kr/view.php?key=20220818010010574,"Thu, 18 Aug 2022 09:40:00 +0900"
525,코로나19 신규 확진자 17만8574명···위중증 환자 470명·사망자 61명,"(CG=중앙신문) 국내 코로나19 일일 신규 확진자 수가 17만8574명으로 집계됐다. 재원중 위중증 환자는... 한편, 국내에서 지난 2020년 1월 20일 코로나19 첫 확진자가 발생한 지 오늘로 942일째를 맞고 있다.",http://www.joongang.tv/news/articleView.html?idxno=56114,http://www.joongang.tv/news/articleView.html?idxno=56114,"Thu, 18 Aug 2022 09:40:00 +0900"
526,"동원F&amp;B, 프리미엄 동원 참치액 출시...""참치 명가 노하우 담았다""","한편, 코로나19로 내식 수요가 증가하자 다양한 요리에 활용할 수 있는 액상 조미료에 대한 수요가 크게 증가하고 있다. 시장조사기관 닐슨코리아에 따르면, 지난해 국내 액상 조미료 시장 규모는 약 500억원으로, 전년... ",http://www.asiaa.co.kr/news/articleView.html?idxno=95861,http://www.asiaa.co.kr/news/articleView.html?idxno=95861,"Thu, 18 Aug 2022 09:40:00 +0900"
527,"깨끗한나라, 추석 명절 맞아 ‘클린 안심선물세트’ 출시","깨끗한나라 관계자는 “최근 코로나19 재유행으로 감염병 불안 요소가 커짐에 따라 철저한 위생 관리가 요구되고 있다”며 “깨끗한나라 클린 안심선물세트로 고마운 마음을 전하고 동시에 가족, 친지 분들의 건강도... ",http://www.edaily.co.kr/news/newspath.asp?newsid=01653126632428632,https://n.news.naver.com/mnews/article/018/0005294883?sid=101,"Thu, 18 Aug 2022 09:40:00 +0900"
528,"신규 확진, 18만명 육박… 전일 대비 소폭 감소(상보)",신종 코로나바이러스 감염증(코로나19) 일일 신규 확진자가 18일 0시 기준 17만8574명으로 집계됐다. 이날 신규 확진자 수는 전일(18만803명) 대비 소폭 감소했다. 일일 사망자는 61명으로 누적... ,http://moneys.mt.co.kr/news/mwView.php?no=2022081809150228861,https://n.news.naver.com/mnews/article/417/0000843824?sid=102,"Thu, 18 Aug 2022 09:40:00 +0900"
529,"경기도, 대만·인도네시아서 &apos;K-뷰티 엑스포&apos; 개최","신종 코로나바이러스 감염증(코로나19) 변수를 고려, 현지 입국이 어려운 참가 기업을 위해서는 현장 부스 운영 대신 현지 통역원 채용을 지원한다. 지사나 협력사가 있는 기업은 현지 직원들이 대신 전시회에 참석... ",http://www.mediapen.com/news/view/747322,http://www.mediapen.com/news/view/747322,"Thu, 18 Aug 2022 09:40:00 +0900"
530,"써모 피셔 사이언티픽, 차세대 백신·치료제 연구솔루션 발표",해당 컬럼은 복잡한 bottom-up 단백질체학 분석을 단순화해 암과 기타 질병 바이오마커 발견과 검출 뿐 아니라 코로나19에서부터 암·희귀 질병에 이르기까지 새로운 치료법 및 백신 개발에 더욱... ,http://www.rapportian.com/news/articleView.html?idxno=150386,http://www.rapportian.com/news/articleView.html?idxno=150386,"Thu, 18 Aug 2022 09:40:00 +0900"
531,"18日 코로나 확진자 &apos;17만8574명&apos;... 개학 시즌 &apos;비상&apos;, 소아 사망자↑",코로나19 확진자가 전주의 1.3배 상승한 가운데 어린이 확진자와 사망자도 함께 증가해 우려의 목소리가 나오고 있다. 사진=연합뉴스   코로나19 확진자가 전주의 1.3배 상승한 가운데 어린이 확진자와 사망자도... ,http://www.pinpointnews.co.kr/news/articleView.html?idxno=136511,http://www.pinpointnews.co.kr/news/articleView.html?idxno=136511,"Thu, 18 Aug 2022 09:40:00 +0900"
532,"코빗, EDM 페스티벌 &apos;울트라 코리아 2022&apos; NFT 판매",오세진 코빗 대표는 “코로나19 여파로 3년 만에 열리는 축제인 만큼 NFT로 평생 소장해 축제를 더 의미 있게 기억할 수 있다”며 “앞으로도 다양한 행사와 연계해 코빗의 NFT를 많은 분들에게 소개하고 싶다”고... ,http://www.etnews.com/20220818000029,https://n.news.naver.com/mnews/article/030/0003037624?sid=101,"Thu, 18 Aug 2022 09:40:00 +0900"
533,신규 확진 17만8574명…전주대비 4만1333명 증가,"코로나19 선별진료소. (자료=뉴스1)코로나19 신규 확진자가 이틀 연속 17만명대를 기록했다.18일 중앙방역대책본부에 따르면 0시 기준 코로나19 신규 확진자는 17만8,574명으로 지난주 같은 기간보다 4만1,333명... ",https://news.mtn.co.kr/news-detail/2022081809360731777,https://news.mtn.co.kr/news-detail/2022081809360731777,"Thu, 18 Aug 2022 09:40:00 +0900"
534,"옹기장학회, 서울ㆍ평양교구 신학생 15명에게 장학금 수여",박신언 몬시뇰은 코로나19로 참석하지 못한 신학생들을 대신해 서울대교구 성소국장 이성우 신부와 평양교구 사무국장 장긍선 신부에게 장학금과 증서를 수여했다. 박신언 몬시뇰은 인사말에서 “북방 선교를 꿈꾸는... ,http://www.cpbc.co.kr/CMS/newspaper/view_body.php?cid=829890&path=202208,http://www.cpbc.co.kr/CMS/newspaper/view_body.php?cid=829890&path=202208,"Thu, 18 Aug 2022 09:40:00 +0900"
535,재유행 정점 언제? 신규 확진 전날보다 줄어 17만8574명,"코로나19 신규 확진자가 전날보다 소폭 줄었지만 여전히 18만 명에 육박했다. 해외 유입 확진은 역대... 전날 오후 5시 기준 코로나19 병상은 총 7,305개다. 병상 가동률은 위중증병상 45.4%, 준중증병상 60.5... ",https://hankookilbo.com/News/Read/A2022081808590000837?did=NA,https://n.news.naver.com/mnews/article/469/0000692182?sid=102,"Thu, 18 Aug 2022 09:39:00 +0900"
536,자가격리 벗어나 바다낚시 즐긴 박형배 전주시의원,코로나19 확진으로 자가격리 중이던 전북 전주시의원이 바다낚시를 즐기다 적발돼 경찰에 고발됐다. 18일... 그러나 박 의원은 해양경찰에서 사고경위를 조사받는 과정에서 코로나19 확진 사실이 들통났다. 박 의원은... ,https://www.seoul.co.kr/news/newsView.php?id=20220818500019&wlog_tag3=naver,https://n.news.naver.com/mnews/article/081/0003295294?sid=102,"Thu, 18 Aug 2022 09:39:00 +0900"
537,"코로나19 신규 확진 178,574명…사망자 61명","코로나19 재유행이 계속되고 있는 가운데 오늘 신규 확진자 수는 17만 명대를 기록했습니다. 중앙방역대책본부는 오늘(18일) 0시 기준 코로나19 신규 확진자 수가 17만 8,574명으로 집계됐다고 밝혔습니다. 이는... ",http://tbs.seoul.kr/news/newsView.do?typ_800=6&idx_800=3476259&seq_800=20468925,http://tbs.seoul.kr/news/newsView.do?typ_800=6&idx_800=3476259&seq_800=20468925,"Thu, 18 Aug 2022 09:39:00 +0900"
538,‘나는솔로’ 9기 오열한 광수♥영숙만 찐사랑…옥순은 스캔들 해명,코로나19에 확진된 영호와 공연 연습으로 불참한 순자를 제외한 출연자들이 한 자리에 모였다. 화기애애한 분위기 속에서 근황을 알렸다. 광수와 영숙은 현재까지 인연을 유지하며 “제작진과의 나름 의리를 지키기... ,,https://n.news.naver.com/mnews/article/415/0000012287?sid=106,"Thu, 18 Aug 2022 09:38:00 +0900"
539,울산교육청 &apos;미래교육&apos; 대비 추경 3890억원 증액 편성,"기사내용 요약 기정예산 2조 1,283억원에 18.3% 증가 총 2조 5173억 규모 코로나19 재확산 대비 방역 강화·미래... 이번 추경은 2학기 코로나19 재확산 대비 방역체계 강화와 미래 교육 기반 조성, 학교 현장의 현안 해결에... ",http://www.newsis.com/view/?id=NISX20220818_0001982260&cID=10814&pID=10800,https://n.news.naver.com/mnews/article/003/0011369402?sid=102,"Thu, 18 Aug 2022 09:38:00 +0900"
540,"엔드레스하우저, 역대 최다 특허 승인 기록","한편, 지난 2021년, 엔드레스하우저 그룹은 매출액의 7.4%에 해당하는 2억 1,000만 유로(한화로 약 2,792억 원)를 연구개발에 투자하는 등 코로나19로 인한 여러 대외변수와 리스크가 산재한 상황에서도 활발한 투자를... ",https://www.hellot.net/news/article.html?no=70637,https://www.hellot.net/news/article.html?no=70637,"Thu, 18 Aug 2022 09:38:00 +0900"
541,"NH농협은행, 코로나19 확산 방지 위해 &apos;방역핀패드&apos; 1,700대 확대 운영","NH농협은행은 코로나19 확산 방지와 고객의 안전한 금융 거래를 위해 19일부터 9월 중순까지 &apos;방역핀패드&apos; 1... 조상진 IT부문 부행장은 ""최근 코로나19 재확산에 따라 확대를 서두르게 되었다""며, ""고객 가치를... ",http://www.nextdaily.co.kr/news/articleView.html?idxno=208824,http://www.nextdaily.co.kr/news/articleView.html?idxno=208824,"Thu, 18 Aug 2022 09:38:00 +0900"
542,고유가시대에 홀로 휘파람 분 정유사들…직원 평균 연봉 &apos;억! 억!&apos;,"이와 관련 업계관계자는 ""2020년 시작된 코로나19로 인해 적자가 크게 늘면서 지난해 급여 수준이 낮았졌다""면서 ""지난해 부터 실적이 크게 개선되면서 올해 상반기 급여가 오른 것""이라고 설명했다. 다만... ",http://www.newsquest.co.kr/news/articleView.html?idxno=99722,http://www.newsquest.co.kr/news/articleView.html?idxno=99722,"Thu, 18 Aug 2022 09:38:00 +0900"
543,[속보] 코로나19 위중증 470명ㆍ사망 61명,이투데이=세종= | [속보] 코로나19 위중증 470명ㆍ사망 61명,https://www.etoday.co.kr/news/view/2164596,https://www.etoday.co.kr/news/view/2164596,"Thu, 18 Aug 2022 09:38:00 +0900"
544,"상장 도시가스사, 상반기 경영실적 전년比 &apos;선방&apos;","이는 코로나19로부터의 내수시장 회복, 동절기 발생했던 한파 등이 주요 원인으로 지목된다.... 이러한 상장사들의 실적개선의 배경에는 지난해 코로나19가 창궐하면서 산업계가 급속도로... ",http://www.todayenergy.kr/news/articleView.html?idxno=251385,http://www.todayenergy.kr/news/articleView.html?idxno=251385,"Thu, 18 Aug 2022 09:38:00 +0900"
